{
    "master_enable": true,
    "receiver_id": "0a174530-e3cf-11e6-bf01-fe55135034f3",
    "activation": {
        "mode": "activate_scheduled_relative",
        "requested_time": "2:0",
        "activation_time": "1496759200:0"
    },
    "transport_params": [{
        "source_ip": "172.29.82.23",
        "destination_ip": "172.29.82.95",
        "source_port": 5000,
        "destination_port": 5000,
        "fec_enabled": true,
        "fec_type": "XOR",
        "fec_mode": "2D",
        "fec_block_width": 50,
        "fec_block_height": 50,
        "fec1D_destination_port": "auto",
        "fec2D_destination_port": "auto",
        "fec1D_source_port": 5010,
        "fec2D_source_port": 5012,
        "rtcp_enabled": true,
        "rtcp_destination_ip": "172.29.82.24",
        "rtcp_destination_port": 5008,
        "rtcp_source_port": 5008,
        "rtp_enabled": true
    }, {
        "source_ip": "172.30.82.23",
        "destination_ip": "172.30.82.95",
        "source_port": 5000,
        "destination_port": 5000,
        "fec_enabled": true,
        "fec_type": "XOR",
        "fec_mode": "2D",
        "fec_block_width": 50,
        "fec_block_height": 50,
        "fec1D_destination_port": "auto",
        "fec2D_destination_port": "auto",
        "fec1D_source_port": 5010,
        "fec2D_source_port": 5012,
        "rtcp_enabled": true,
        "rtcp_destination_ip": "172.30.82.24",
        "rtcp_destination_port": 5008,
        "rtcp_source_port": 5008,
        "rtp_enabled": true
    }]
}
